[
  {
    "case": "test-2000-clean",
    "expected_trials": 6,
    "fault": "clean",
    "invalid": false,
    "missing": [],
    "should_flag": false
  },
  {
    "case": "test-2000-drop",
    "expected_trials": 6,
    "fault": "drop",
    "invalid": false,
    "missing": [
      {
        "id": "3",
        "trial": 1
      }
    ],
    "should_flag": true
  },
  {
    "case": "test-2000-duplicate",
    "expected_trials": 6,
    "fault": "duplicate",
    "invalid": true,
    "missing": [],
    "should_flag": true
  },
  {
    "case": "test-2000-error",
    "expected_trials": 6,
    "fault": "error",
    "invalid": false,
    "missing": [],
    "should_flag": true
  },
  {
    "case": "test-2000-nan",
    "expected_trials": 6,
    "fault": "nan",
    "invalid": true,
    "missing": [],
    "should_flag": true
  },
  {
    "case": "test-2000-shuffled_epochs",
    "expected_trials": 6,
    "fault": "shuffled_epochs",
    "invalid": false,
    "missing": [],
    "should_flag": false
  },
  {
    "case": "test-2000-partial_retries",
    "expected_trials": 6,
    "fault": "partial_retries",
    "invalid": false,
    "missing": [
      {
        "id": "1",
        "trial": 2
      },
      {
        "id": "2",
        "trial": 2
      },
      {
        "id": "3",
        "trial": 2
      }
    ],
    "should_flag": true
  },
  {
    "case": "test-2001-clean",
    "expected_trials": 6,
    "fault": "clean",
    "invalid": false,
    "missing": [],
    "should_flag": false
  },
  {
    "case": "test-2001-drop",
    "expected_trials": 6,
    "fault": "drop",
    "invalid": false,
    "missing": [
      {
        "id": "3",
        "trial": 1
      }
    ],
    "should_flag": true
  },
  {
    "case": "test-2001-duplicate",
    "expected_trials": 6,
    "fault": "duplicate",
    "invalid": true,
    "missing": [],
    "should_flag": true
  },
  {
    "case": "test-2001-error",
    "expected_trials": 6,
    "fault": "error",
    "invalid": false,
    "missing": [],
    "should_flag": true
  },
  {
    "case": "test-2001-nan",
    "expected_trials": 6,
    "fault": "nan",
    "invalid": true,
    "missing": [],
    "should_flag": true
  },
  {
    "case": "test-2001-shuffled_epochs",
    "expected_trials": 6,
    "fault": "shuffled_epochs",
    "invalid": false,
    "missing": [],
    "should_flag": false
  },
  {
    "case": "test-2001-partial_retries",
    "expected_trials": 6,
    "fault": "partial_retries",
    "invalid": false,
    "missing": [
      {
        "id": "1",
        "trial": 2
      },
      {
        "id": "2",
        "trial": 2
      },
      {
        "id": "3",
        "trial": 2
      }
    ],
    "should_flag": true
  },
  {
    "case": "test-2002-clean",
    "expected_trials": 6,
    "fault": "clean",
    "invalid": false,
    "missing": [],
    "should_flag": false
  },
  {
    "case": "test-2002-drop",
    "expected_trials": 6,
    "fault": "drop",
    "invalid": false,
    "missing": [
      {
        "id": "2",
        "trial": 1
      }
    ],
    "should_flag": true
  },
  {
    "case": "test-2002-duplicate",
    "expected_trials": 6,
    "fault": "duplicate",
    "invalid": true,
    "missing": [],
    "should_flag": true
  },
  {
    "case": "test-2002-error",
    "expected_trials": 6,
    "fault": "error",
    "invalid": false,
    "missing": [],
    "should_flag": true
  },
  {
    "case": "test-2002-nan",
    "expected_trials": 6,
    "fault": "nan",
    "invalid": true,
    "missing": [],
    "should_flag": true
  },
  {
    "case": "test-2002-shuffled_epochs",
    "expected_trials": 6,
    "fault": "shuffled_epochs",
    "invalid": false,
    "missing": [],
    "should_flag": false
  },
  {
    "case": "test-2002-partial_retries",
    "expected_trials": 6,
    "fault": "partial_retries",
    "invalid": false,
    "missing": [
      {
        "id": "1",
        "trial": 2
      },
      {
        "id": "2",
        "trial": 2
      },
      {
        "id": "3",
        "trial": 2
      }
    ],
    "should_flag": true
  },
  {
    "case": "test-2003-clean",
    "expected_trials": 6,
    "fault": "clean",
    "invalid": false,
    "missing": [],
    "should_flag": false
  },
  {
    "case": "test-2003-drop",
    "expected_trials": 6,
    "fault": "drop",
    "invalid": false,
    "missing": [
      {
        "id": "3",
        "trial": 2
      }
    ],
    "should_flag": true
  },
  {
    "case": "test-2003-duplicate",
    "expected_trials": 6,
    "fault": "duplicate",
    "invalid": true,
    "missing": [],
    "should_flag": true
  },
  {
    "case": "test-2003-error",
    "expected_trials": 6,
    "fault": "error",
    "invalid": false,
    "missing": [],
    "should_flag": true
  },
  {
    "case": "test-2003-nan",
    "expected_trials": 6,
    "fault": "nan",
    "invalid": true,
    "missing": [],
    "should_flag": true
  },
  {
    "case": "test-2003-shuffled_epochs",
    "expected_trials": 6,
    "fault": "shuffled_epochs",
    "invalid": false,
    "missing": [],
    "should_flag": false
  },
  {
    "case": "test-2003-partial_retries",
    "expected_trials": 6,
    "fault": "partial_retries",
    "invalid": false,
    "missing": [
      {
        "id": "1",
        "trial": 2
      },
      {
        "id": "2",
        "trial": 2
      },
      {
        "id": "3",
        "trial": 2
      }
    ],
    "should_flag": true
  },
  {
    "case": "test-2004-clean",
    "expected_trials": 6,
    "fault": "clean",
    "invalid": false,
    "missing": [],
    "should_flag": false
  },
  {
    "case": "test-2004-drop",
    "expected_trials": 6,
    "fault": "drop",
    "invalid": false,
    "missing": [
      {
        "id": "3",
        "trial": 2
      }
    ],
    "should_flag": true
  },
  {
    "case": "test-2004-duplicate",
    "expected_trials": 6,
    "fault": "duplicate",
    "invalid": true,
    "missing": [],
    "should_flag": true
  },
  {
    "case": "test-2004-error",
    "expected_trials": 6,
    "fault": "error",
    "invalid": false,
    "missing": [],
    "should_flag": true
  },
  {
    "case": "test-2004-nan",
    "expected_trials": 6,
    "fault": "nan",
    "invalid": true,
    "missing": [],
    "should_flag": true
  },
  {
    "case": "test-2004-shuffled_epochs",
    "expected_trials": 6,
    "fault": "shuffled_epochs",
    "invalid": false,
    "missing": [],
    "should_flag": false
  },
  {
    "case": "test-2004-partial_retries",
    "expected_trials": 6,
    "fault": "partial_retries",
    "invalid": false,
    "missing": [
      {
        "id": "1",
        "trial": 2
      },
      {
        "id": "2",
        "trial": 2
      },
      {
        "id": "3",
        "trial": 2
      }
    ],
    "should_flag": true
  },
  {
    "case": "test-2005-clean",
    "expected_trials": 6,
    "fault": "clean",
    "invalid": false,
    "missing": [],
    "should_flag": false
  },
  {
    "case": "test-2005-drop",
    "expected_trials": 6,
    "fault": "drop",
    "invalid": false,
    "missing": [
      {
        "id": "3",
        "trial": 2
      }
    ],
    "should_flag": true
  },
  {
    "case": "test-2005-duplicate",
    "expected_trials": 6,
    "fault": "duplicate",
    "invalid": true,
    "missing": [],
    "should_flag": true
  },
  {
    "case": "test-2005-error",
    "expected_trials": 6,
    "fault": "error",
    "invalid": false,
    "missing": [],
    "should_flag": true
  },
  {
    "case": "test-2005-nan",
    "expected_trials": 6,
    "fault": "nan",
    "invalid": true,
    "missing": [],
    "should_flag": true
  },
  {
    "case": "test-2005-shuffled_epochs",
    "expected_trials": 6,
    "fault": "shuffled_epochs",
    "invalid": false,
    "missing": [],
    "should_flag": false
  },
  {
    "case": "test-2005-partial_retries",
    "expected_trials": 6,
    "fault": "partial_retries",
    "invalid": false,
    "missing": [
      {
        "id": "1",
        "trial": 2
      },
      {
        "id": "2",
        "trial": 2
      },
      {
        "id": "3",
        "trial": 2
      }
    ],
    "should_flag": true
  },
  {
    "case": "test-2006-clean",
    "expected_trials": 6,
    "fault": "clean",
    "invalid": false,
    "missing": [],
    "should_flag": false
  },
  {
    "case": "test-2006-drop",
    "expected_trials": 6,
    "fault": "drop",
    "invalid": false,
    "missing": [
      {
        "id": "3",
        "trial": 2
      }
    ],
    "should_flag": true
  },
  {
    "case": "test-2006-duplicate",
    "expected_trials": 6,
    "fault": "duplicate",
    "invalid": true,
    "missing": [],
    "should_flag": true
  },
  {
    "case": "test-2006-error",
    "expected_trials": 6,
    "fault": "error",
    "invalid": false,
    "missing": [],
    "should_flag": true
  },
  {
    "case": "test-2006-nan",
    "expected_trials": 6,
    "fault": "nan",
    "invalid": true,
    "missing": [],
    "should_flag": true
  },
  {
    "case": "test-2006-shuffled_epochs",
    "expected_trials": 6,
    "fault": "shuffled_epochs",
    "invalid": false,
    "missing": [],
    "should_flag": false
  },
  {
    "case": "test-2006-partial_retries",
    "expected_trials": 6,
    "fault": "partial_retries",
    "invalid": false,
    "missing": [
      {
        "id": "1",
        "trial": 2
      },
      {
        "id": "2",
        "trial": 2
      },
      {
        "id": "3",
        "trial": 2
      }
    ],
    "should_flag": true
  },
  {
    "case": "test-2007-clean",
    "expected_trials": 6,
    "fault": "clean",
    "invalid": false,
    "missing": [],
    "should_flag": false
  },
  {
    "case": "test-2007-drop",
    "expected_trials": 6,
    "fault": "drop",
    "invalid": false,
    "missing": [
      {
        "id": "1",
        "trial": 2
      }
    ],
    "should_flag": true
  },
  {
    "case": "test-2007-duplicate",
    "expected_trials": 6,
    "fault": "duplicate",
    "invalid": true,
    "missing": [],
    "should_flag": true
  },
  {
    "case": "test-2007-error",
    "expected_trials": 6,
    "fault": "error",